id,author,created,title,content,subreddit,url,num_comments,score,upvote_ratio,comments
197f416,30299578815310,2024-01-15 17:59:33+00:00,"[D] Code vs JSON output for LLM agents? Frameworks like LangChain rely on LLMs responding with JSON syntax, while agents like Octopus, CaP, and Voyager directly control agents via code.","[CaP](https://arxiv.org/pdf/2209.07753.pdf), [Voyager](https://arxiv.org/pdf/2305.16291.pdf), [Octopus](https://arxiv.org/abs/2310.08588)

I work primarily with JSON based agents but code-as-policy agents seem to be extremely powerful. Here are some of the benefits and weaknesses I've seen

Pros of code

1. Less tool creation needed - The prebuilt math/file/string/list manipulation abilities that come with code are enormous. In a JSON based agent, you would have to formally declare each of these as a tool which you expose to the LLM and explain in your prompting, which is a lot of work and eats up a ton of the context window. 
2. Reduced number of transactions - The LLM can write scripts that invoke multiple tools and manipulate their results in ways that are difficult to do in a single transaction via JSON. For example, in one script, the model could search a DB 3 times, perform regex on the query results, convert them to integers, and add them up. Doing this in one step via JSON tool invocations is basically impossible. 
3. Less syntax errors - this might be totally just vibe-based reasoning, but it really seems like LLMs have an easier time writing valid python than valid JSON, especially when you have lots of nested arguments in your methods.

Cons

1. Crazy risky - This is the obvious one. You have a machine executing random code. There are ways to mitigate this but still. I mean seriously we all learned not to use eval, so it is crazy to basically see research tending towards just running eval on the outputs of these models. 
2. Scripts with errors - Sometimes the model tries to get too fancy and writes complex programs that have bugs, resulting in many needed retries. 

Do any of you have thoughts or experience with these approaches in the wild? 

Is anybody aware of any experiments that compare these two approaches against each other? 

&#x200B;",MachineLearning,https://www.reddit.com/r/MachineLearning/comments/197f416/d_code_vs_json_output_for_llm_agents_frameworks/,5,5,0.73,<praw.models.comment_forest.CommentForest object at 0x0000026E34254550>
197fw4f,Nano_9a9o,2024-01-15 18:29:40+00:00,"NLI sentence transformers VS general purpose ones, for RAG applications [Discussion]","I've been looking into RAG, and have come across using sentence transformers for querying and semantic comparison.

Recently, I've discovered that NLI models are specifically designed for matching up queries to answers, which seems super useful, and yet all the ones on the sentence-transformers hugging face are like 2 years old, which is practically centuries ago in AI time, as opposed to the ""all"" models, which see much more focused on semantic similarity comparison.

Am I missing something here? Surely people aren't using years old models for modern RAG applications, right?",MachineLearning,https://www.reddit.com/r/MachineLearning/comments/197fw4f/nli_sentence_transformers_vs_general_purpose_ones/,1,3,1.0,<praw.models.comment_forest.CommentForest object at 0x0000026E3322FED0>
1971c6h,APaperADay,2024-01-15 05:46:49+00:00,[R] COSMO: COntrastive Streamlined MultimOdal Model with Interleaved Pre-Training,"**Paper**: [https://arxiv.org/abs/2401.00849](https://arxiv.org/abs/2401.00849)

**Code**: [https://github.com/showlab/cosmo](https://github.com/showlab/cosmo)

**Models**: [https://huggingface.co/Awiny](https://huggingface.co/Awiny)

**Dataset**: [https://huggingface.co/datasets/Awiny/Howto-Interlink7M](https://huggingface.co/datasets/Awiny/Howto-Interlink7M)

**Project page**: [https://fingerrec.github.io/cosmo/](https://fingerrec.github.io/cosmo/)

**Abstract**:

>In the evolution of Vision-Language Pre-training, shifting from  short-text comprehension to encompassing extended textual contexts is  pivotal. Recent autoregressive vision-language models like \[Flamingo, PaLM-E\], leveraging the long-context capability of Large  Language Models, have excelled in few-shot text generation tasks but  face challenges in alignment tasks. Addressing this gap, we introduce  the contrastive loss into text generation models, presenting the  COntrastive-Streamlined MultimOdal framework (**CosMo**), strategically  partitioning the language model into dedicated unimodal text processing  and adept multimodal data handling components. CosMo, our unified  framework, merges unimodal and multimodal elements, enhancing model  performance for tasks involving textual and visual data while notably  reducing learnable parameters. However, these models demand extensive  long-text datasets, yet the availability of high-quality long-text video  datasets remains limited. To bridge this gap, this work introduces **Howto-Interlink7M**, an inaugural interleaved video-text dataset featuring  comprehensive captions, marking a significant step forward.  Demonstrating its impact, we illustrate how Howto-Interlink7M enhances  model performance in image-text tasks. With 34% learnable parameters  and utilizing 72% of the available data, our model demonstrates  significant superiority over OpenFlamingo. For  instance, in the 4-shot flickr captioning task, performance notably  improves from 57.2% to 65.1%. The contributions of CosMo and Howto-Interlink7M are underscored by notable performance gains across  14 diverse downstream datasets encompassing both image-text and  video-text tasks.",MachineLearning,https://www.reddit.com/r/MachineLearning/comments/1971c6h/r_cosmo_contrastive_streamlined_multimodal_model/,1,6,0.81,<praw.models.comment_forest.CommentForest object at 0x0000026E33235190>
196ryle,franticpizzaeater,2024-01-14 22:16:42+00:00,[P] Trying to calculate semantic difference of words.,"I am working on a project, I have a list of target words, and need to calculate the difference of meaning between these words and new words. It is mostly a word similarity task.  


Say, the target word is ""car"", the model need to output high value for ""dog"" and low value for ""Jeep""; or vice versa. Currently I am using huggingface's sentence transformer library for this, and (1-Cosine Similarity) as difference score. But the performance is not up to the expectations. Is there any way to improve the performance? Should I use some other library/model/metrics?  


Thank you.",MachineLearning,https://www.reddit.com/r/MachineLearning/comments/196ryle/p_trying_to_calculate_semantic_difference_of_words/,12,24,0.85,<praw.models.comment_forest.CommentForest object at 0x0000026E34289110>
1973l79,gxcells,2024-01-15 08:07:31+00:00,[D] LORAs for GANs,"Hi the sub.
I want to train some GAN models (like pix2pix) but it seems that it is really difficult to train a GAN with good quality.

Is it possible to train a LORA for GANs?

Edit: just found that new paper
E2GAN: Efficient Training of Efficient GANs for Image-to-Image Translation

https://arxiv.org/abs/2401.06127",MachineLearning,https://www.reddit.com/r/MachineLearning/comments/1973l79/d_loras_for_gans/,1,2,0.63,<praw.models.comment_forest.CommentForest object at 0x0000026E34299790>
197q4k8,ManInBlue7777,2024-01-16 01:23:59+00:00,ML project ideas [p],"Hi all, We urgently require a SUBSTANTIAL dataset for our school project. Unfortunately, we have exhausted our options, and the upcoming presentation is just around the corner. We are feeling anxious as we haven't finalized our project topic yet, unlike other groups who have already chosen their topics and are actively working on them. Any assistance with obtaining a LIVE dataset would be greatly appreciated.

Thank you.",MachineLearning,https://www.reddit.com/r/MachineLearning/comments/197q4k8/ml_project_ideas_p/,0,0,0.08,<praw.models.comment_forest.CommentForest object at 0x0000026E3429A810>
197gdzw,ibbi1020,2024-01-15 18:48:31+00:00,[D] 365datascience Reviews?,"Hey everyone, I'm a freshman making my way to becoming an AI/ML engineer. I'm seeing alot of ads from 365datascience for their subscription sale event (ending in 2 days). I took a course when they went completely free back in decemeber (i think) and I liked it, learned alot of LR in python.

I'm thinking of buying their subscription plan while its on sale, but the issue is I'm from a third-world country and the economy is a travesty so I want to make sure if their courses are actually good or was my experience a one-off thing, I dont want to waste good money on a investment thats a waste of time (even 60 bucks a year is alot for where I'm from, unfortunatly). Drop your reviews of 365datascience if you've taken their courses. How good are they compared to free resources on the internet?",MachineLearning,https://www.reddit.com/r/MachineLearning/comments/197gdzw/d_365datascience_reviews/,0,0,0.38,<praw.models.comment_forest.CommentForest object at 0x0000026E3426AD50>
196wqsl,amirkasraaa,2024-01-15 01:50:07+00:00,[D] Self-implementing Rabbit tech's LAM,"I saw the hype about Rabbit R1 and humane ai. I only found a research paper for Rabbit ai ([https://www.rabbit.tech/research](https://www.rabbit.tech/research)). Unfortunately the ""research paper"" wasn't detailed to give me some insight into how I can implement an AI like this. Do you guys have any idea how somebody can effectively self train an ""LAM""? And wouldn't it be easier If you just made a launcher with this A.I that would interact with native apps directly to cut off the need of digital processing?

I'm really sorry for this unorganized post 🙏",MachineLearning,https://www.reddit.com/r/MachineLearning/comments/196wqsl/d_selfimplementing_rabbit_techs_lam/,11,7,0.65,<praw.models.comment_forest.CommentForest object at 0x0000026E342CDA50>
19776ck,BigDreamx,2024-01-15 12:03:28+00:00,[D] Workshops,"1. Is submitting to multiple workshops at the same conference allowed? What about difference conferences? I have a few that align well with my paper, but his is not mentioned elsewhere.

2. Also, is it good practice as an undergrad to submit to workshops to get reviews and extend my work given that I don't have an advisor?

3. If I don't think my work can be extended to a conference paper after my acceptance to a workshop, should I just stop or continue?",MachineLearning,https://www.reddit.com/r/MachineLearning/comments/19776ck/d_workshops/,5,0,0.33,<praw.models.comment_forest.CommentForest object at 0x0000026E34297C90>
196f4z9,Pritish-Mishra,2024-01-14 12:46:53+00:00,"I controlled Super Mario with ""Activity Recognition"" using just my smartphone! [P]","Recently, I worked on a project involving activity recognition, **which is the process of identifying and understanding human activities based on data collected from sensors**. The only thing I had was a single old smartphone, as I had no money to invest in additional sensors.

My ultimate goal was to control Super Mario inside the game using my real-world movements. After conducting some research, I discovered that most smartphones are equipped with an accelerometer sensor, which I could leverage to train a machine learning model for activity recognition. Fortunately, my old smartphone had one. I then developed an app capable of streaming real-time sensor data from my smartphone to my laptop wirelessly (I named this app ""SensorFlow"").

Using this data, I built and trained a machine learning model that could accurately detect my actions with a remarkable 95% accuracy. In the end, I integrated this model with Super Mario, using python to programmatically hit the arrow keys based on my real-world movements. I ended up with a system where I can play Super Mario just by using my body! It is not a 100% but it works well enough. Additional suggestions are welcome.

I have open-sourced all the code related to activity recognition and the Android app I developed in the process.

For more information on this project, you can check out my YouTube. This is a self-promotion, but it has additional information on the project. You can see the final result below 👇

[https://www.youtube.com/watch?v=IpLV6uKAO98](https://www.youtube.com/watch?v=IpLV6uKAO98)",MachineLearning,https://www.reddit.com/r/MachineLearning/comments/196f4z9/i_controlled_super_mario_with_activity/,32,65,0.87,<praw.models.comment_forest.CommentForest object at 0x0000026E3435AF10>
196sva4,vocdex,2024-01-14 22:54:40+00:00,[D] [R] Causality and model-based RL: possible connection?,"Hey everyone! I've been diving into the world of model-based Reinforcement Learning (RL) and its relationship with causal inference, and I find myself intrigued yet slightly puzzled.(Please let me know if my understanding makes sense at all)

On the one hand, model-based RL, with its focus on learning the dynamics of an environment, seems to naturally lend itself to answering ""what if"" questions. The ability to predict the outcomes of actions without actual real-world trials feels very much like causal inference. But then, does this mean model-based RL is inherently capable of full-blown causal inference?

My understanding is that causal inference not only involves predicting outcomes (interventions) but also delving into counterfactual reasoning - understanding what would have happened under different past actions. I'm wondering how well model-based RL handles this aspect, given its dependency on the accuracy and completeness of the learned model.

I'm curious about the community's thoughts on this:

1. Are there any limitations to the kind of causal questions that a model-based RL system can answer?
2. How might integrating explicit causal models into model-based RL frameworks enhance their capabilities?

Would love to hear your insights or any relevant research that could shed light on this intersection!",MachineLearning,https://www.reddit.com/r/MachineLearning/comments/196sva4/d_r_causality_and_modelbased_rl_possible/,2,8,1.0,<praw.models.comment_forest.CommentForest object at 0x0000026E342A0290>
1971j09,AIsavvy,2024-01-15 05:57:47+00:00,"[R] How to calculate the score of a new datapoint by a score based diffusion model(song & ermon, 2019)?","I have a pretrained score based diffusion model trained on 64X64 images. Now I want to calculate the score of a new image(of same dimension) through this pre-trained neural network.

The score network takes two inputs :

1. x\_t : Sample at timestamp t
2. t : timestamp

How should I calculate the score of a new image via this pre-trained neural network ?",MachineLearning,https://www.reddit.com/r/MachineLearning/comments/1971j09/r_how_to_calculate_the_score_of_a_new_datapoint/,2,2,1.0,<praw.models.comment_forest.CommentForest object at 0x0000026E3435BE10>
196uam1,Im_The_Tall_Guy,2024-01-14 23:55:36+00:00,[D] How should I go about implementing a custom quantization method?,"
Hey everyone! I’ve been doing research on quantizing llms and I have a couple of custom methods that I’d like to test out. Looking at existing implementations like Tim Dettmers’ bitsandbytes makes me feel as lost as ever. Looking at llama.cpp source hasn’t helped much either. Has anyone had experience with implementing and more importantly evaluating a custom quantization method? Please share any thoughts and if you have any questions please feel free to ask. Thnaks!",MachineLearning,https://www.reddit.com/r/MachineLearning/comments/196uam1/d_how_should_i_go_about_implementing_a_custom/,2,6,0.8,<praw.models.comment_forest.CommentForest object at 0x0000026E331B8B10>
196tumn,AdFew4357,2024-01-14 23:36:11+00:00,What kinds of departments research modern experimental design? [D],,MachineLearning,/r/statistics/comments/196kq1y/what_kinds_of_departments_research_modern/,3,4,0.83,<praw.models.comment_forest.CommentForest object at 0x0000026E330996D0>
196fnf3,kekkimo,2024-01-14 13:15:36+00:00,[D] What happens when we generate tokens beyond the training context length of LLMs?,Let's say for example an LLM was trained on 2048 tokens and we generate texts beyond 2048 tokens. What's the issue and why?,MachineLearning,https://www.reddit.com/r/MachineLearning/comments/196fnf3/d_what_happens_when_we_generate_tokens_beyond_the/,19,25,0.87,<praw.models.comment_forest.CommentForest object at 0x0000026E3436EA10>
196r0ya,ade17_in,2024-01-14 21:38:51+00:00,[P] Projects on Diffusion models,"I'll be applying to thesis position and topic I'm looking forward to is something related to diffusion models (or maybe ViT). (do suggest any other topics which you feel have potential) 

I'm done with theoritcal part concerning diffusion models and building on from scratch on a MNIST, CIFAR. I watched many tutorials and participated paper discussions as well. But still don't feel much confident in it and looking forward working on a extensive project which might further improve my understanding and also my CV. 

Any project idea recommedation? Is medical image synthesis or making scenes for autonomous driving a good way to start? 

Also it will be helpful if I get github repos, links, blog, videos which you think might be helpful! 

Thanks!",MachineLearning,https://www.reddit.com/r/MachineLearning/comments/196r0ya/p_projects_on_diffusion_models/,2,3,1.0,<praw.models.comment_forest.CommentForest object at 0x0000026E34363F90>
196lpy8,johnyeocx,2024-01-14 17:55:21+00:00,[P] Trying to make cloud infrastructure as simple as possible for ML engs. What do you think?,"Hey guys! Over the past few months, I talked to several ML engineers (mostly startup founders) and realised that one thing all of them disliked was setting up & managing cloud infrastructure for their backend or ML model. Although there are services like Render, for some reason, they all opted to do it hardcore with AWS / Azure / GCP. Not sure why, but anyways, these services do have a lot of overhead which make them tedious or difficult, especially for first timers.

So, I decided that I wanted to build something which makes it really easy to deploy your ML services to cloud providers like AWS, whether it’s an inference server, REST API, or some job queue, so that ML engs can focus on other more interesting things.

Right now I’ve built a really simple (maybe useless, hopefully not) first version, [www.eliseapp.com](http://www.eliseapp.com/), which helps you deploy a FastAPI app to AWS app runner (on your own account) in one click. I’d love to get feedback on it, but more so, what problems you’ve personally encountered when trying to deploy your ML application and what services you’d expect on such a platform! Thanks :)",MachineLearning,https://www.reddit.com/r/MachineLearning/comments/196lpy8/p_trying_to_make_cloud_infrastructure_as_simple/,0,6,0.71,<praw.models.comment_forest.CommentForest object at 0x0000026E343619D0>
196ecrb,FSoft_AIC,2024-01-14 12:00:12+00:00,[Research] RepoPilot: Multi-Agent Coding Assistant that Can Understand and Generate Code at Repository Level,"We release **RepoPilot**, a multi-agent system that can understand and interact with the whole code repository.

RepoPilot is a one-stop Python library that revolutionizes the way developers interact with and understand their codebases. Utilizing advanced Large Language Models (LLMs), RepoPilot acts as a multi-agent system, offering a next-generation **coding assistant** for comprehensive codebase exploration and impact analysis. Designed for developers who seek deeper insights into their projects, RepoPilot simplifies complex code analysis tasks, making it an indispensable tool for modern software development.

Unlike other coding assistants, such as Github Copilot, Tabnine etc, or a single CodeLLMs, RepoPilot is engineered to grasp the full context of your entire codebase, enabling a more comprehensive analysis and more accurate recommendations.

More Information can be found here: [https://github.com/FSoft-AI4Code/RepoPilot](https://github.com/FSoft-AI4Code/RepoPilot)",MachineLearning,https://www.reddit.com/r/MachineLearning/comments/196ecrb/research_repopilot_multiagent_coding_assistant/,3,15,0.86,<praw.models.comment_forest.CommentForest object at 0x0000026E3434C890>
195q6lu,Successful-Western27,2024-01-13 15:16:47+00:00,[R] Google DeepMind Diagnostic LLM Exceeds Human Doctor Top-10 Accuracy (59% vs 34%),"Researchers from Google and DeepMind have developed and evaluated an LLM fine-tuned specifically for clinical diagnostic reasoning. In a new study, they rigorously tested the LLM's aptitude for generating differential diagnoses and aiding physicians.

They assessed the LLM on 302 real-world case reports from the New England Journal of Medicine. These case reports are known to be highly complex diagnostic challenges.

The LLM produced differential diagnosis lists that included the final confirmed diagnosis in the top 10 possibilities in 177 out of 302 cases, a top-10 accuracy of 59%. **This significantly exceeded the performance of experienced physicians, who had a top-10 accuracy of just 34% on the same cases when unassisted.**

According to assessments from senior specialists, the LLM's differential diagnoses were also rated to be **substantially more appropriate and comprehensive** than those produced by physicians, when evaluated across all 302 case reports.

This research demonstrates the potential for LLMs to enhance physicians' clinical reasoning abilities for complex cases. However, the authors emphasize that further rigorous real-world testing is essential before clinical deployment. Issues around model safety, fairness, and robustness must also be addressed.

[**Full summary**](https://aimodels.substack.com/p/googles-new-llm-doctor-is-right-way). [**Paper**](https://arxiv.org/abs/2401.05654).",MachineLearning,https://www.reddit.com/r/MachineLearning/comments/195q6lu/r_google_deepmind_diagnostic_llm_exceeds_human/,130,542,0.96,<praw.models.comment_forest.CommentForest object at 0x0000026E343C8210>
1974bt1,Hewwo-Is-me-again,2024-01-15 08:57:42+00:00,Figure out networks best possible performance on dataset before training [D],"I have an issue where I don't have access to a lot of hardware, meaning  that training models takes forever, like at least a few days to be able  to see whether an image generation model will turn out the way I want or  not. So are there techniques to figure out roughly how a model will  preform before training or figure out the optimal model to get the  result I want?",MachineLearning,https://www.reddit.com/r/MachineLearning/comments/1974bt1/figure_out_networks_best_possible_performance_on/,10,0,0.31,<praw.models.comment_forest.CommentForest object at 0x0000026E34384E10>
196np4b,tankuppp,2024-01-14 19:19:36+00:00,[D] Textbook on applied forecasting with R with exercises and solutions,"Hi,

I'm student taking a course in ""applied forecasting"". One of the challenging is identifying graphs: white noise, acf, pacf, Holts Winters and many of the variants. Is there a text book that has exercises and examples. The content I'm referring often is Hyndman book, but I need visual exercises to grasp the materials better.",MachineLearning,https://www.reddit.com/r/MachineLearning/comments/196np4b/d_textbook_on_applied_forecasting_with_r_with/,2,4,0.75,<praw.models.comment_forest.CommentForest object at 0x0000026E34387790>
19655al,Salty-Dare-4821,2024-01-14 02:31:21+00:00,[D] easy to criticize papers for undergrads,"i'm TAing an intro to research class. i want to teach students how to critically review a paper (consider experimental design, results, etc) by having them walk through some examples. do y'all know of any easy to read ML papers that have some obvious flaws/shortcomings?",MachineLearning,https://www.reddit.com/r/MachineLearning/comments/19655al/d_easy_to_criticize_papers_for_undergrads/,24,63,0.92,<praw.models.comment_forest.CommentForest object at 0x0000026E343DA050>
196vk5c,GraphHopper77,2024-01-15 00:52:40+00:00,[D] Validating a custom dataaset,"If i have to create a custom dataset to train a model, how can I makesure the dataset is valid",MachineLearning,https://www.reddit.com/r/MachineLearning/comments/196vk5c/d_validating_a_custom_dataaset/,0,1,0.67,<praw.models.comment_forest.CommentForest object at 0x0000026E343D4390>
