id,author,created,title,content,subreddit,url,num_comments,score,upvote_ratio,comments
199l2m9,Expensive_Charity293,2024-01-18 08:03:13+00:00,[D] Does this paper's partitioning cause data leakage?,"I recently got into a rather heated discussion about [this study](https://onlinelibrary.wiley.com/doi/abs/10.1002/smj.3023). The TLDR is that they used textual embeddings and gradient boosting to predict CEO personality scores from earnings call transcripts. They analyzed ~200 CEOs, segmenting each CEO's calls into multiple parts to increase data points. However, each CEO appears in both the training and validation sets with different segments of their calls. Imo, this should cause data leakage because the model may pick up on idiosyncraticities of the individual CEOs' language usage, rather than the patterns of the underlying Data Generating Process. What's your take on this?",MachineLearning,https://www.reddit.com/r/MachineLearning/comments/199l2m9/d_does_this_papers_partitioning_cause_data_leakage/,46,117,0.93,<praw.models.comment_forest.CommentForest object at 0x0000026E32F50390>
19a4u80,Fun-Medium8799,2024-01-18 23:53:00+00:00,[D] Speaker Diarization with video recognition of lips moving,"Hello! I'm currently using whisperx for speaker recognition and it's pretty good. Still, I remember reading there is another speaker diarization framework that uses image recognition to identify when the lips of the speaker are moving to give a more precise identification. Does anyone know what framework this is? I've been searching all week but can't find it. Thanks!",MachineLearning,https://www.reddit.com/r/MachineLearning/comments/19a4u80/d_speaker_diarization_with_video_recognition_of/,0,6,1.0,<praw.models.comment_forest.CommentForest object at 0x0000026E32F0F310>
19afcch,Periplokos,2024-01-19 09:34:55+00:00,[D] When will the tentative agreement on the AI act in Europe become formally adopted?," A month or so ago European Union agreed upon a set of tentative rules regarding the regulation of AI, the so-called AI-act.

While certain countries like Germany and France initially resisted some of the more dubious measures of the AI-act such as the regulation of the foundation models, they eventually agreed on such regulation.

>Does anyone know when the tentative agreement on the AI act in Europe become formally adopted?

 ",MachineLearning,https://www.reddit.com/r/MachineLearning/comments/19afcch/d_when_will_the_tentative_agreement_on_the_ai_act/,0,1,0.6,<praw.models.comment_forest.CommentForest object at 0x0000026E32F3E010>
199yknn,APaperADay,2024-01-18 19:34:05+00:00,[R] Context-Aware Meta-Learning,"**arXiv**: [https://arxiv.org/abs/2310.10971](https://arxiv.org/abs/2310.10971)

**OpenReview**:

[https://openreview.net/forum?id=lJYAkDVnRU](https://openreview.net/forum?id=lJYAkDVnRU)

[https://openreview.net/forum?id=SAu298HU2I](https://openreview.net/forum?id=SAu298HU2I)

**Abstract**:

>Large Language Models like ChatGPT demonstrate a remarkable capacity to  learn new concepts during inference without any fine-tuning. However,  visual models trained to detect new objects during inference have been  unable to replicate this ability, and instead either perform poorly or  require meta-training and/or fine-tuning on similar objects. In this  work, we propose a meta-learning algorithm that emulates Large Language  Models by learning new visual concepts during inference without  fine-tuning. Our approach leverages a frozen pre-trained feature  extractor, and analogous to in-context learning, recasts meta-learning  as sequence modeling over datapoints with known labels and a test  datapoint with an unknown label. On 8 out of 11 meta-learning  benchmarks, our approach -- without meta-training or fine-tuning --  exceeds or matches the state-of-the-art algorithm, P>M>F, which is  meta-trained on these benchmarks.",MachineLearning,https://www.reddit.com/r/MachineLearning/comments/199yknn/r_contextaware_metalearning/,1,14,0.94,<praw.models.comment_forest.CommentForest object at 0x0000026E32E02890>
199y7y9,APaperADay,2024-01-18 19:19:32+00:00,[R] Mixture of Tokens: Efficient LLMs through Cross-Example Aggregation,"**Paper**: [https://arxiv.org/abs/2310.15961](https://arxiv.org/abs/2310.15961)

**Code**: [https://github.com/llm-random/llm-random](https://github.com/llm-random/llm-random)

**Blog post**: [https://llm-random.github.io/posts/mixture\_of\_tokens/](https://llm-random.github.io/posts/mixture_of_tokens/)

**Abstract**:

>Despite the promise of Mixture of Experts (MoE) models in increasing  parameter counts of Transformer models while maintaining training and  inference costs, their application carries notable drawbacks. The key  strategy of these models is to, for each processed token, activate at  most a few experts - subsets of an extensive feed-forward layer. But  this approach is not without its challenges. The operation of matching  experts and tokens is discrete, which makes MoE models prone to issues  like training instability and uneven expert utilization. Existing  techniques designed to address these concerns, such as auxiliary losses  or balance-aware matching, result either in lower model performance or  are more difficult to train. In response to these issues, we propose  **Mixture of Tokens**, a fully-differentiable model that retains the  benefits of MoE architectures while avoiding the aforementioned  difficulties. Rather than routing tokens to experts, this approach mixes  tokens from different examples prior to feeding them to experts,  enabling the model to learn from all token-expert combinations.  Importantly, this mixing can be disabled to avoid mixing of different  sequences during inference. Crucially, this method is fully compatible  with both masked and causal Large Language Model training and inference.

**Previous discussion**: [https://www.reddit.com/r/mlscaling/comments/17ha25s/mixture\_of\_tokens\_efficient\_llms\_through/](https://www.reddit.com/r/mlscaling/comments/17ha25s/mixture_of_tokens_efficient_llms_through/)",MachineLearning,https://www.reddit.com/r/MachineLearning/comments/199y7y9/r_mixture_of_tokens_efficient_llms_through/,1,12,1.0,<praw.models.comment_forest.CommentForest object at 0x0000026E32F30850>
199zyfh,Direct-Touch469,2024-01-18 20:30:16+00:00,How costly is it to obtain labeled data? [D],"

Doing my masters thesis in Active Learning. A key point in the literature is active learning may be useful in situations where there’s lots of unlabeled data, and the cost associated with labeling is high, so active learning can effectively same time and effort in labeling, if the model can “choose” a subset of samples which are the most “informative” and then these can be labeled.

However, I kinda realized, as much as this active learning stuff is interesting and I’m probably continuing, I just don’t quite get when it would be a realistic scenario in a company for labeled data not being available/being highly costly. Of course, I know when I read it there are specific instances where this occurs:

NLP - tasks like speech recognition may require audio to be labeled, or in information extraction requires annotations and certain things within a corpus to be annotated


However, the literature I’m reading is a survey from like 2009, I’d imagine since then problems like these just don’t exist really. So I’m wondering how often there’s just a pool of unlabeled data waiting to be labeled. Is there even a demand for active learning these days?

I think one area I’m “pivoting” to is to maybe looking at active learning in online “streaming” data where I’d imagine stuff isn’t labeled as quickly.",MachineLearning,https://www.reddit.com/r/MachineLearning/comments/199zyfh/how_costly_is_it_to_obtain_labeled_data_d/,15,7,0.74,<praw.models.comment_forest.CommentForest object at 0x0000026E32F2A3D0>
199n479,great_waldini,2024-01-18 10:28:18+00:00,"[D] How did OpenAI increase context length of the GPT-4 iterations? Did they retrain GPT-4-1106 from scratch? Or was it a hackier mix of techniques like sparse attention, chunking, etc?","As the title states, got to thinking about the GPT-4 derivative models and how they were made. I know things are moving fast, and OpenAI is anything but ""open"", but what's the speculation on how it was done?

I'm not up on all the latest details of LLM progress, but from my understanding of the attention mechanism, typically you'd have to retrain a transformer from scratch to increase context size.

But if that's the case, wouldn't they have to redo all the RLHF too? Or are there efficient transfer learning techniques for the RLHF step?

I'd love to see some papers comparing evals of the GPT-4 iterations to one another, if ya'll know of any you can link. Even assuming the RLHF were perfectly transferable, wouldn't we still expect there to be measurable differences between the models in the GPT-4 family?

I wonder if there's any insightful performance quirks between the models, e.g. for coding tasks perhaps the 32k 0613 model performs better than the 8k base model, but the 128k 1106 is worse than 0613 due to depreciating returns of context size given the same number of parameters, same training data, etc.",MachineLearning,https://www.reddit.com/r/MachineLearning/comments/199n479/d_how_did_openai_increase_context_length_of_the/,6,48,0.94,<praw.models.comment_forest.CommentForest object at 0x0000026E32F148D0>
199v9kr,eusben,2024-01-18 17:17:59+00:00,[P] WhisperSpeech - An Open Source text-to-speech system,"An Open Source text-to-speech system built by inverting Whisper. 

[https://github.com/collabora/WhisperSpeech](https://github.com/collabora/WhisperSpeech)",MachineLearning,https://www.reddit.com/r/MachineLearning/comments/199v9kr/p_whisperspeech_an_open_source_texttospeech_system/,0,9,0.91,<praw.models.comment_forest.CommentForest object at 0x0000026E32F35550>
19aac2d,sushilkhadakaanon,2024-01-19 04:18:02+00:00,[D] what does q(x_t-1|x_t) indicates intuitively in diffusion process?,"I understand the forward and riverse diffusion process and the meaning of intermediate marvok's transition.
q(x_t|x_t-1) is a Gaussian , and it's a distribution when x_t-1 is know, a transition upon adding of noise.
P(x_t-1|x_t) is the transition from x_t to x_t-1 indicating reverse process. This is the one we seek to optimize (2015 paper) and is represented as a NN. 
But while formulating a loss function, a new distribution comes into picture, q(x_t-1|x_t) , and we can compute this with bayes rule. But I wonder what q(x_t-1|x_t) indicates? Any intuitive definition?",MachineLearning,https://www.reddit.com/r/MachineLearning/comments/19aac2d/d_what_does_qx_t1x_t_indicates_intuitively_in/,11,0,0.5,<praw.models.comment_forest.CommentForest object at 0x0000026E32E96490>
19a9txq,holdenonthehill,2024-01-19 03:51:28+00:00,[D] Tool that combines voice cloning + audio track editing?," **Question:** is there a software/tool that combines audio track editing with built-in voice cloning? If not, how could I make one?

**Problem:** I do a lot of work with audiobooks and podcasts for clients. If the narrator of an audiobook messes up a word or sentence, it requires having them come back into the studio and re-record it. Recently, I've been using voice AI cloning to generate the line I need in the author's voice. However, I still have to then export the audio file, open the original track in an audio editing software like Audition, and then insert the new line where I need. Then repeat the process for any other instances. It's time consuming. I'm looking for a software that allows you to edit the audio track with built-in access to the voice cloning tool like Photoshop's generative fill.

**Idea:** If there's nothing else out there, I'd like to create a software/website portal that allows audio editors to use voice cloning the same as generative fill in Photoshop. Essentially, they can cut and edit their audio files like normal, but they can also select a portion of the audio track, type a word or sentence, and then generate a voice-cloned replacement that fits directly at the location selected in the original speaker's voice. This would streamline audio editing and voice cloning integration.

Thanks for any ideas and/or direction on how to develop this!",MachineLearning,https://www.reddit.com/r/MachineLearning/comments/19a9txq/d_tool_that_combines_voice_cloning_audio_track/,0,0,0.5,<praw.models.comment_forest.CommentForest object at 0x0000026E32F52A50>
19af18f,create4drawing,2024-01-19 09:12:57+00:00,Looking for eli5 [R],"I work with a machine learning model, and I always have problems explaining what is going on with the model, some key points:

How important are training sets (and accuracy)
What happens when retraining
What Is machine learning 

I am not a model developer, but I keep looking for sources for eli5 (explain it like I'm 5) type materials for explaining these and other things, does anyone have some interesting materials I can look at, maybe someone has already done some work that I can coat tail",MachineLearning,https://www.reddit.com/r/MachineLearning/comments/19af18f/looking_for_eli5_r/,1,0,0.33,<praw.models.comment_forest.CommentForest object at 0x0000026E32DD08D0>
199y7g2,Fluid-Physics-5663,2024-01-18 19:18:56+00:00,[D] Creating Shadows on Foreground Objects,"I'm experimenting with computer vision and learning the basics. Right now, I'm trying to add shadows to a foreground object in a .png file and then put it on a light background. I looked for research papers about adding shadows to objects but couldn't find any, except this [one](https://github.com/bcmi/libcom/blob/main/docs/shadow_generation.md). There don't seem to be any Python libraries for this either. I'm wondering why. Is it too difficult, or is it something that doesn't need machine learning?",MachineLearning,https://www.reddit.com/r/MachineLearning/comments/199y7g2/d_creating_shadows_on_foreground_objects/,2,4,1.0,<praw.models.comment_forest.CommentForest object at 0x0000026E32F2B3D0>
199xzlb,Outlandish_MurMan,2024-01-18 19:09:49+00:00,[D] Blog on Systematic approach to debugging Machine Learning Projects,"Hi,

I wrote an article on Systematic approach to debugging ML projects. Please let me know your thoughts. Anything to improve or anymore debugging tricks are much appreciated..

[https://medium.com/@gitlostmurali/debugging-your-machine-learning-project-8d1897676050?sk=5d30bfe483b97eb0dc4275565234ccad](https://medium.com/@gitlostmurali/debugging-your-machine-learning-project-8d1897676050?sk=5d30bfe483b97eb0dc4275565234ccad)",MachineLearning,https://www.reddit.com/r/MachineLearning/comments/199xzlb/d_blog_on_systematic_approach_to_debugging/,0,4,0.83,<praw.models.comment_forest.CommentForest object at 0x0000026E32DB3CD0>
199qw5i,ashenone420,2024-01-18 14:05:30+00:00,[R] EPU-CNN: Generalized Additive CNN for Interpretable Computer Vision,"Paper: [https://www.nature.com/articles/s41598-023-38459-1](https://www.nature.com/articles/s41598-023-38459-1)

Code: [https://github.com/innoisys/EPU-CNN](https://github.com/innoisys/EPU-CNN)

Abstract: The adoption of convolutional neural network (CNN) models in high-stake domains is hindered by their inability to meet society’s demand for transparency in decision-making. So far, a growing number of methodologies have emerged for developing CNN models that are interpretable by design. However, such models are not capable of providing interpretations in accordance with human perception, while maintaining competent performance. In this paper, we tackle these challenges with a novel, general framework for instantiating inherently interpretable CNN models, named E pluribus unum interpretable CNN (EPU-CNN). An EPU-CNN model consists of CNN sub-networks, each of which receives a different representation of an input image expressing a perceptual feature, such as color or texture. The output of an EPU-CNN model consists of the classification prediction and its interpretation, in terms of relative contributions of perceptual features in different regions of the input image. EPU-CNN models have been extensively evaluated on various publicly available datasets, as well as a contributed benchmark dataset. Medical datasets are used to demonstrate the applicability of EPU-CNN for risk-sensitive decisions in medicine. The experimental results indicate that EPU-CNN models can achieve a comparable or better classification performance than other CNN architectures while providing humanly perceivable interpretations. ",MachineLearning,https://www.reddit.com/r/MachineLearning/comments/199qw5i/r_epucnn_generalized_additive_cnn_for/,0,10,1.0,<praw.models.comment_forest.CommentForest object at 0x0000026E32DB2C90>
199wwhq,lightSpeedBrick,2024-01-18 18:25:38+00:00,[D] What Causes LLM Performance To Degrade When Exceeding Training Context Length?,"Hello folks

I am going through the StreamingLLMs paper [https://arxiv.org/pdf/2309.17453.pdf](https://arxiv.org/pdf/2309.17453.pdf) and came back to a question I've been wondering about for some time. Is there a good understanding what ""limits"" the context length within a transformer? Why can't it generalize beyond the sequence length that it was trained on.

One guess I had was that it was to do with original absolute positional embeddings. Once you exceed a certain positional index you can't assign a unique positional embedding to the newest token (since the sin/cos functions used are periodic) - please correct me if that hunch is incorrect.

However, newer models use relative positional embeddings such as RoPE, AliBi and YaRN. If I am not mistaken the motivation behind those works, at least partially, is to help models generalize beyond their original training context length. However, based on what the Streaming LLM paper demonstrates, this isn't really the case for RoPE or AliBi embeddings. They don't touch upon YaRN as far as I can tell.

What is the reason that this happens? How does introducing new tokens that push the input sequence length beyond that at training mess with the performance of the model? My two best wild guesses are that maybe it's a) due to the SoftMax distribution within the attention taking on values that the model isn't used to seeing as the length exceeds the training window or maybe b) as the sequences gets longer and longer more and more information is packed into the intermediate token representations within the transformer and going beyond the context length used at training adds extra information that the model that it can't handle?

As I mentioned, these are just random wild guesses, so I would love to know if there's a proper answer to this or what the current line of thinking might be!

&#x200B;",MachineLearning,https://www.reddit.com/r/MachineLearning/comments/199wwhq/d_what_causes_llm_performance_to_degrade_when/,2,4,0.75,<praw.models.comment_forest.CommentForest object at 0x0000026E32F28490>
19a1c1n,stardoge42,2024-01-18 21:25:35+00:00,Continous Learning MARL in Fighting Game Research [D]," 

My friend and I are doing research on using MARL in the context of a fighting game where the actors / agents submit inputs simeltaneously and are then resolved by the fighting game physics engine. There are numerous papers that talk about DL / RL / some MARL in the context of fighting games, but notably they do not include source code or actually talk about their methodologies so much as they do talk about generalized findings / insights.

Right now were looking at using Pytorch (running on CUDA for training speed) using Petting Zoo (extension of gymnasium for MARL) specifically using the AgileRL library for hyperparameter optimization. We are well aware that there are so many hyperparameters that knowing what to change is tricky as we try to refine the problem. We are envisioning that we have 8 or so instances of the research game engine (I have 10 core CPU) connected to 10 instances of a Petting Zoo (possibly Agile RL modified) training environment where the inputs / outputs are continuously fed back and forth between the engine and the training environment, back and forth.

I guess I'm asking for some general advice / tips and feedback on the tools we're using. If you know of specific textbooks, research papers of GitHub repos that have tackled a similar problem, that could be very helpful. We have some resources on Hyperparameter optimziation and some ideas for how to fiddle with the settings, but the initial structure of the project / starting code just to get the AI learning is a little tricky. We do have a Connect 4 training example of MARL working, provided by AgileRL. But we're seeking to adapt this from turn by turn input submission to simeltaneous input submission (which is certainly possible, MARL is used in live games such as MOBAs and others).

ANY information you can give us is a blessing and is helpful. Thanks so much for your time.",MachineLearning,https://www.reddit.com/r/MachineLearning/comments/19a1c1n/continous_learning_marl_in_fighting_game_research/,2,2,0.75,<praw.models.comment_forest.CommentForest object at 0x0000026E32F5A950>
19932kw,RobbinDeBank,2024-01-17 18:01:17+00:00,[R] AlphaGeometry: An Olympiad-level AI system for geometry,"Blog: https://deepmind.google/discover/blog/alphageometry-an-olympiad-level-ai-system-for-geometry/

Paper: https://www.nature.com/articles/s41586-023-06747-5

Github: https://github.com/google-deepmind/alphageometry

Abstract: 

Proving mathematical theorems at the olympiad level represents a notable milestone in human-level automated reasoning, owing to their reputed difficulty among the world’s best talents in pre-university mathematics. Current machine-learning approaches, however, are not applicable to most mathematical domains owing to the high cost of translating human proofs into machine-verifiable format. The problem is even worse for geometry because of its unique translation challenges, resulting in severe scarcity of training data. We propose AlphaGeometry, a theorem prover for Euclidean plane geometry that sidesteps the need for human demonstrations by synthesizing millions of theorems and proofs across different levels of complexity. AlphaGeometry is a neuro-symbolic system that uses a neural language model, trained from scratch on our large-scale synthetic data, to guide a symbolic deduction engine through infinite branching points in challenging problems. On a test set of 30 latest olympiad-level problems, AlphaGeometry solves 25, outperforming the previous best method that only solves ten problems and approaching the performance of an average International Mathematical Olympiad (IMO) gold medallist. Notably, AlphaGeometry produces human-readable proofs, solves all geometry problems in the IMO 2000 and 2015 under human expert evaluation and discovers a generalized version of a translated IMO theorem in 2004.",MachineLearning,https://www.reddit.com/r/MachineLearning/comments/19932kw/r_alphageometry_an_olympiadlevel_ai_system_for/,67,252,0.97,<praw.models.comment_forest.CommentForest object at 0x0000026E32FA5290>
