id,author,created,title,content,subreddit,url,num_comments,score,upvote_ratio,comments
1942524,DesperadoCoder,2024-01-11 13:49:20+00:00,[D] Step into Machine Learning without Mathematics experience,"Hello everyone,

I am an experienced software developer with over 20 years experience in back-end development with .net and c# mainly but lately also doing some python work with web scraping and DJango.  I am really enjoying python so far, and was thinking of starting to dabble with AI and ML using python.  I did some basic tutorials so far using the usual libraries such as Pandas, NumPy and SciKit-Learn, but I have barely touched the surface.

I found these quite complex although very interesting. I would like to continue on this path, however my maths is really bad.  I do not know anything about algorithms, calculus, probabilities etc.

So my question to seasoned AI and ML developers, do I really need to understand maths very well to continue on this journey, or my experience in software development can get me by?  Is there any area of AI that does not need heavy maths?

I would like to continue on this journey but I am not sure if it is worth invest my time and money in this when I can maybe continue expanding on web development.

Thank you in advance!",MachineLearning,https://www.reddit.com/r/MachineLearning/comments/1942524/d_step_into_machine_learning_without_mathematics/,13,0,0.29,<praw.models.comment_forest.CommentForest object at 0x0000026E34592050>
192z048,APaperADay,2024-01-10 04:00:17+00:00,[R] MoE-Mamba: Efficient Selective State Space Models with Mixture of Experts,"**Paper**: [https://arxiv.org/abs/2401.04081](https://arxiv.org/abs/2401.04081)

**Code**: [https://github.com/llm-random/llm-random](https://github.com/llm-random/llm-random)

**Abstract**:

>State Space Models (SSMs) have become serious contenders in the field  of  sequential modeling, challenging the dominance of Transformers. At  the  same time, Mixture of Experts (MoE) has significantly improved   Transformer-based LLMs, including recent state-of-the-art open-source   models. We propose that to unlock the potential of SSMs for scaling,   they should be combined with MoE. We showcase this on Mamba, a recent   SSM-based model that achieves remarkable, Transformer-like performance.   Our model, **MoE-Mamba**, outperforms both Mamba and  Transformer-MoE. In  particular, MoE-Mamba reaches the same performance  as Mamba in 2.2x less  training steps while preserving the inference  performance gains of  Mamba against the Transformer.",MachineLearning,https://www.reddit.com/r/MachineLearning/comments/192z048/r_moemamba_efficient_selective_state_space_models/,4,40,0.93,<praw.models.comment_forest.CommentForest object at 0x0000026E34575290>
193bole,Dependent_Mushroom98,2024-01-10 16:03:08+00:00,Popular machine models in airlines industry…[D],"What are some of the interesting usecases that are being pursued by airlines and how is GenAI and other ML models playing a big role in it? 

Some of the use cases that I like to understand mostly stem from operations Research areas such as :

1. Forecast in real time cost for a seat to maximize profits?
2. How to optimize for flight schedules given weather delays and other airport/Airtraffic controller related cancellations? 
3. How to rebook the passenger last
Minute  on another flight for the best outcomes for the passenger and airlines (assuming #2 has happened above)?

Any ML models paradigm fits the above usecases? Appreciate the insights….",MachineLearning,https://www.reddit.com/r/MachineLearning/comments/193bole/popular_machine_models_in_airlines_industryd/,6,3,0.57,<praw.models.comment_forest.CommentForest object at 0x0000026E346A52D0>
194dua3,outeastor,2024-01-11 22:01:36+00:00,"[D] An Idea, AI That Can Identify the Top and Bottom Performers in Tech","As AI advances, many companies are looking for ways to reduce their employee costs and increase their productivity. Some employees are lazy, unproductive, or working multiple jobs, as seen in [r/overemployed](https://www.reddit.com/r/overemployed/). This makes the few hard-working and skilled employees more valuable.

My startup idea is to create an AI system that analyzes the git activity of tech employees, such as the content of the tickets you have done, commits, and project relevance, and identifies the best and worst performers every month. This system would not monitor the employees’ personal data or activities, so it would respect their privacy.",MachineLearning,https://www.reddit.com/r/MachineLearning/comments/194dua3/d_an_idea_ai_that_can_identify_the_top_and_bottom/,18,0,0.09,<praw.models.comment_forest.CommentForest object at 0x0000026E34699890>
19394mc,Any-Ad-3888,2024-01-10 14:10:32+00:00,Why packing is a good technique to find lower bounds? [R],"In learning theory, finding lower bounds for sample complexity uses techniques like defining a packing set on the hypothesis space. Concretely, given m samples and their labels, this provides m bits of information for the target model and thus cannot distinguish log\_2(m) functions which are ""reasonably"" far away (the packing set).

In learning theory, finding lower bounds for sample complexity involves defining a packing set on the hypothesis space. Concretely, given m samples and their labels, this provides m bits of information for the target model and thus cannot distinguish log\_2(m) functions that are ""reasonably"" far away (the packing set).(M) + log\_2(1- delta) by using packing sets?",MachineLearning,https://www.reddit.com/r/MachineLearning/comments/19394mc/why_packing_is_a_good_technique_to_find_lower/,4,5,0.73,<praw.models.comment_forest.CommentForest object at 0x0000026E34698750>
1939mue,transformer_ML,2024-01-10 14:34:06+00:00,[D] Large Language Model 2023 Review and 2024 Outlook,"Medium: [https://medium.com/@kentsui/large-language-model-2023-review-and-2024-outlook-cbd5211cf49b](https://medium.com/@kentsui/large-language-model-2023-review-and-2024-outlook-cbd5211cf49b)

Substack: [https://paperdigest.substack.com/p/aimachine-learning-mostly-llm-2023](https://paperdigest.substack.com/p/aimachine-learning-mostly-llm-2023)

What do you think of 2024?",MachineLearning,https://www.reddit.com/r/MachineLearning/comments/1939mue/d_large_language_model_2023_review_and_2024/,2,4,0.83,<praw.models.comment_forest.CommentForest object at 0x0000026E346A9190>
192yvmo,gw109,2024-01-10 03:53:29+00:00,[R] Brain-Inspired Machine Intelligence: A Survey of Neurobiologically-Plausible Credit Assignment,[https://arxiv.org/abs/2312.09257](https://arxiv.org/abs/2312.09257),MachineLearning,https://www.reddit.com/r/MachineLearning/comments/192yvmo/r_braininspired_machine_intelligence_a_survey_of/,0,19,0.95,<praw.models.comment_forest.CommentForest object at 0x0000026E34599190>
1936hj1,MrGolran,2024-01-10 11:48:35+00:00,[D] Evaluation for Quantile Probabilistic forecast," I'm training a model that performs probabilistic forecasting where it outputs a probability distribution instead of a single point estimate for each time step. So for each timestep I get a value for each quantile I have defined (q20,q50,q80..etc) . 

 I saw that most evaluation approaches either use the median for each timestep (q50) to calculate the MAPE and other metrics or use specific probabilistic forecasting metrics like LogS, CRPS and VarS.

 In order to compare the probabilistic forecast model with other deterministic models is it valid to get the MAPE for the test set by using for each timestep the predicted value with the minimum difference from the actual target value ? This implies that for different timesteps values from different quantiles might be used to evaluate performance. Do you think that is a good approach or is that cheating ? ",MachineLearning,https://www.reddit.com/r/MachineLearning/comments/1936hj1/d_evaluation_for_quantile_probabilistic_forecast/,5,4,1.0,<praw.models.comment_forest.CommentForest object at 0x0000026E34598B50>
193e54u,Evermore2307,2024-01-10 17:44:20+00:00,Need to Generate Conversations [D],"I've some transcripts of conversations between agents and customers. I need to generate synthetic conversations using those conversations. Can any of you suggest me how to proceed? I need a model that can take many transcripts as input and produce similar ones. Context window is an issue. Even if that's resolved, what prompts to provide?",MachineLearning,https://www.reddit.com/r/MachineLearning/comments/193e54u/need_to_generate_conversations_d/,1,0,0.5,<praw.models.comment_forest.CommentForest object at 0x0000026E346AE090>
193cgo4,Electronic-Letter592,2024-01-10 16:36:03+00:00,[Discussion] Translation models for longer texts,"I was trying popular MT models, such as SeamlessM4T-v2, Open-NLLB, MADLAD-400 from huggingface. It seems that they support only very short texts, like 1 sentence. I am wondering if I am missing something, or how would you use them to translate a few pages of texts?",MachineLearning,https://www.reddit.com/r/MachineLearning/comments/193cgo4/discussion_translation_models_for_longer_texts/,0,1,1.0,<praw.models.comment_forest.CommentForest object at 0x0000026E3459A5D0>
192y4tf,ic10503,2024-01-10 03:14:57+00:00,[P] Machine Learning for Imbalanced Data Book + GitHub Repo,"Self-promotion alert: I recently wrote a book, ""Machine Learning for Imbalanced Data.""

The book primarily focuses on classification problems, where too little data or too much data for one or more classes leads to an imbalance. Data imbalance (unbalance) or class imbalance has been a controversial topic to write about, with criticism about sampling techniques leading to model miscalibration issues and a host of other problems. However, this book aims to do justice to both sides of the coin, going over the pros and cons of the various techniques.

📘 Here is the Amazon link: [https://www.amazon.com/Machine-Learning-Imbalanced-Data-imbalanced/dp/1801070830/](https://www.amazon.com/Machine-Learning-Imbalanced-Data-imbalanced/dp/1801070830/)

The first half of the book covers sampling techniques, weighting techniques, threshold-tuning techniques for structured data and classical models. The second half of the book caters to unstructured data and deep learning models using PyTorch. Finally, it concludes with model calibration in the context of imbalanced data (model calibration is quite important for several real-world applications but somehow remains underappreciated in technical books)

The accompanying GitHub repository offers Jupyter notebooks (one-click run on Google Colab), and additional resources complementing the book's content: [https://github.com/PacktPublishing/Machine-Learning-for-Imbalanced-Data](https://github.com/PacktPublishing/Machine-Learning-for-Imbalanced-Data).

It took me some time to gather information on whether and how big companies deal with data imbalance and what strategies they use in production, which I documented [here](https://github.com/PacktPublishing/Machine-Learning-for-Imbalanced-Data/blob/main/industry-applications-imbalanced-data.md).

It took me one and a half years to write the book. Your feedback and suggestions will be highly appreciated and will be invaluable for future editions (in case I happen to write it 😊)

(Official book website: [https://imbalanceddata.com/](https://imbalanceddata.com/))",MachineLearning,https://www.reddit.com/r/MachineLearning/comments/192y4tf/p_machine_learning_for_imbalanced_data_book/,2,10,0.92,<praw.models.comment_forest.CommentForest object at 0x0000026E346AF1D0>
192tj1t,ComedyIsOver,2024-01-09 23:43:22+00:00,"Why is the IAF-VAE model called ""inverse"" autoregressive flow (IAF)? [D]","What's so ""inverse"" about it? I understand section 3 in the paper (Inverse Autoregressive Transformations) but I fail to see how section 4 (Inverse Autoregressive Flow (IAF)) follows from there. Do we choose a specific ordering of latent variables, as we do in section 3? 

I'd appreciate it if someone could point me to a blog post that walks you through the details of the IAF-VAE model.

Here is the paper: [https://arxiv.org/pdf/1606.04934.pdf](https://arxiv.org/pdf/1606.04934.pdf)  
",MachineLearning,https://www.reddit.com/r/MachineLearning/comments/192tj1t/why_is_the_iafvae_model_called_inverse/,6,16,0.87,<praw.models.comment_forest.CommentForest object at 0x0000026E346B9490>
193a8uj,GraphHopper77,2024-01-10 15:01:31+00:00,[R] Adversarial example detection,"I'm an under graduate, im planning to create a vision transformer based adversarial example classification model trained on raw adversarial and clean images, what are the things that I should consider during the development process regarding model selection and feature engineering",MachineLearning,https://www.reddit.com/r/MachineLearning/comments/193a8uj/r_adversarial_example_detection/,0,0,0.4,<praw.models.comment_forest.CommentForest object at 0x0000026E346AF350>
1939w0b,selfpromoting,2024-01-10 14:45:27+00:00,[D] Comparing two images taken at different angles,"Hello reddit,

I am looking to compare two or more images or the same object taken over the course of a decade from slightly different angles. I would like to know whether certain characteristics of the object from the first photo remain in the last photo.

More specifically, my intent is to compare two pictures of a roof to figure out whether the various colorations/wear/deterioration shown in first photo have remained the same as in the more recent photo---my intent is to determine whether the roof was ever replaced during the interim years between the two photos.

Any application out there already doing this? Any idea what such a comparison might be called?

Thanks!",MachineLearning,https://www.reddit.com/r/MachineLearning/comments/1939w0b/d_comparing_two_images_taken_at_different_angles/,4,0,0.4,<praw.models.comment_forest.CommentForest object at 0x0000026E346B7410>
1938zb1,chamouloxx,2024-01-10 14:03:32+00:00,[D] Is there an index for machine learning conferences ?,"Hello,

I'm looking for a proper page up to date with conferences on Machine Learning, when are next ones planned, worldwide (i'm mostly interested by europe ones).

Bonus is you also have python related conferences, MLOps....

&#x200B;

I found this page: [http://conferences.visionbib.com/Iris-Conferences.html](http://conferences.visionbib.com/Iris-Conferences.html)

Thanks",MachineLearning,https://www.reddit.com/r/MachineLearning/comments/1938zb1/d_is_there_an_index_for_machine_learning/,3,0,0.4,<praw.models.comment_forest.CommentForest object at 0x0000026E3459A790>
192ra9a,pikachuunibyo,2024-01-09 22:12:17+00:00,Training loss decreases expectedly then goes wild after first epoch? [D],"In the first epoch the training loss is decreasing at a pleasant rate, but then since the second epoch begins wildly flailing about. I've tried 1e-5, -6, and seemed to follow the same pattern. Validation also plateaus. I've never encountered this before, is this a local minimum problem? This run is 6 epochs, but I'm currently turning it up to 20 epochs to see its behavior, since it looked optimistic at step 25k.

The model is google/electra-large-discriminator for token classification, and the optimizer is adamw. No other modifications like layer freezing, weight decay, layerwise weight decay were used.

https://preview.redd.it/f6ydsuzcnhbc1.png?width=1210&format=png&auto=webp&s=075f8da8ad5dab863cfa189bfc235b32658a459d

**\[Update\]**

I ran a couple more tests with Electra over 20 epochs, using a much smaller dataset. Below are the train/valid losses. Using LR=5e-6 (the dark blue line), electra finally reached an approximately diagonal confusion matrix.

[There seems to be a bifurcation point at 700 training steps, probably around 15-20 epochs, and the orange session \(1e-5\) is the first run to correctly predict something nontrivial \(even though it's still terrible\).](https://preview.redd.it/8ajlg1dxhibc1.png?width=1249&format=png&auto=webp&s=6c7b8845c43b5af210e842f7702eca66c2d554f8)

[Validation loss: bifurcation pt showing at the 700 step for larger step sizes.](https://preview.redd.it/9bsrk9wxhibc1.png?width=1249&format=png&auto=webp&s=deca4403db2e8028bf4c222da15ed2b3d58ead8a)

**\[Update 2\]**

Ugh... I spoke too soon. I took the most stable learning rate and switched to the 100x larger dataset, and the same freakout happens after 5 epochs.

https://preview.redd.it/niasjqib3pbc1.png?width=828&format=png&auto=webp&s=473a4b09463bd00d8748227b874b6862b646224b",MachineLearning,https://www.reddit.com/r/MachineLearning/comments/192ra9a/training_loss_decreases_expectedly_then_goes_wild/,8,11,0.76,<praw.models.comment_forest.CommentForest object at 0x0000026E346BEF90>
1935lb8,L4HPlz,2024-01-10 10:51:19+00:00,[D] Overtrained RVC Model?," I used the [guide](https://rvc-models.com/t/how-to-create-a-rvc-model-tutorial/11) from rvcmodels.com to begin training my first model, but I'm having trouble determining if there's a point of overtraining on the TensorBoard graph. The screenshot in the guide shows a noticeable indication, but I haven't observed one on mine. Is my model overtrained, and if so, at what value? It's at 650 epochs and utilized a 69-minute  dataset, if that helps. 

https://preview.redd.it/cwwe1cl2flbc1.png?width=1471&format=png&auto=webp&s=b86ec7a6fd5efe4b42884b90fcdd2ca4243476ef",MachineLearning,https://www.reddit.com/r/MachineLearning/comments/1935lb8/d_overtrained_rvc_model/,4,0,0.4,<praw.models.comment_forest.CommentForest object at 0x0000026E346BFAD0>
192aj3h,convolutionality,2024-01-09 09:06:52+00:00,What are weaknesses of the field currently? [D],"Hi all,

Does anyone have any concept of technical and business related gaps and weaknesses of this field? Things that if were possible or more efficient, would make projects and model optimal? For example (not necessarily a massive case anymore) lack of quality datasets. 

Thanks big time!",MachineLearning,https://www.reddit.com/r/MachineLearning/comments/192aj3h/what_are_weaknesses_of_the_field_currently_d/,88,95,0.89,<praw.models.comment_forest.CommentForest object at 0x0000026E3470B290>
192k8b4,25cmderespeito,2024-01-09 17:30:37+00:00,[R] Testing MAMBA architecture KV-Retrieval and RAG capabilities," I am about to test the capabilities of MAMBA in a similar way to the paper [Lost in the Middle: How Language Models Use Long Contexts](https://arxiv.org/pdf/2307.03172.pdf), but as it is a lot of work, I am asking if anyone did this already. ",MachineLearning,https://www.reddit.com/r/MachineLearning/comments/192k8b4/r_testing_mamba_architecture_kvretrieval_and_rag/,3,21,0.96,<praw.models.comment_forest.CommentForest object at 0x0000026E345A29D0>
192q8cd,Smart-Emu5581,2024-01-09 21:30:27+00:00,[R] Supervised Learning with interactions?,"I am doing research on supervised learning and I am thinking about a concept that really ought to have a name, but I can find nothing about it in the literature.

The idea is to have a supervised learning task where the model can send a limited number of queries and receive answers to them before it has to decide on the output.

As an example: The input could be an image classification task where most of the image is hidden behind a shadow. The model is allowed to specify up to three chunks for which the shadows are removed before it has to submit its classification.

This could also be represented as a reinforcement learning task, but it is much more specific than general-purpose reinforcement learning and the output is supposed to be trained on an MSE loss function, not a reward function.

Is there a name for this sort of problem in the literature?",MachineLearning,https://www.reddit.com/r/MachineLearning/comments/192q8cd/r_supervised_learning_with_interactions/,7,7,0.9,<praw.models.comment_forest.CommentForest object at 0x0000026E346E0D10>
19366tw,qualaric,2024-01-10 11:30:01+00:00,[D] Any good alternatives to RVC for AI cover song maker,"For context, I haven't use RVC yet!! The problem is the install file from the official GitHub page got a **malware** according my antivirus (Bitdiffender) and also the project has been pretty much abandoned!!",MachineLearning,https://www.reddit.com/r/MachineLearning/comments/19366tw/d_any_good_alternatives_to_rvc_for_ai_cover_song/,0,0,0.25,<praw.models.comment_forest.CommentForest object at 0x0000026E346FA490>
1937vnj,TheUnmaykr,2024-01-10 13:07:39+00:00,"""[Research]"" Need image classification models for a project","Hey  , I'm currently an undergrad doing a project under a PhD scholar on a  multi-modal classifier that takes images and text detect hateful content

For that we have used resnet50 and vgg16 for image classification but both gave an accuracy of below 70%.

So  please can you guys help me out and name a few models that have very  high imagine classification accuracy and are able to defend Adversarial  Attacks.  
Thank you",MachineLearning,https://www.reddit.com/r/MachineLearning/comments/1937vnj/research_need_image_classification_models_for_a/,6,0,0.36,<praw.models.comment_forest.CommentForest object at 0x0000026E345A4690>
193cmsa,munkyhed,2024-01-10 16:43:06+00:00,[D] good AI events vs empty hype?,Which AI-focused events are actually informative about cutting edge tech and good for professionals vs empty bluster from brands who want to be seen as thought leaders?,MachineLearning,https://www.reddit.com/r/MachineLearning/comments/193cmsa/d_good_ai_events_vs_empty_hype/,5,0,0.22,<praw.models.comment_forest.CommentForest object at 0x0000026E346CFB90>
193596f,Fit-Rub3325,2024-01-10 10:28:18+00:00,"""[Discussion]"" Address Normalization implementation"," 

Hi, as the title says, I am working on developing a solution where I can develop an in house geocoding API, that can help me in cleaning faulty, unnormalized addresses.

I have a dataset of faulty addresses and used map APIs to get the correct addresses for the same.

What I want to develop is something similar to these API, where if a person enters faulty addresses ( this means, misspelling, wrong pin code, missing city, state or street or any other anomaly), he/she can retrieve the correct addresses. Of course this requires matching with correct addresses.

I have tried few solutions like:

1. levenshtein distance - but searching through database every time will be overkill
2. Using embeddings approach - but getting very poor accuracy, as the document vectors for each country is almost similar (when address taken collectively), similar results were found using word and sub word level vectors too.

My curiosity is how and what solution Google has implemented, so it's accurate almost 95% of the time?

Any suggestions are welcome :)",MachineLearning,https://www.reddit.com/r/MachineLearning/comments/193596f/discussion_address_normalization_implementation/,2,0,0.33,<praw.models.comment_forest.CommentForest object at 0x0000026E346E0B10>
1929n4f,Used-Ad-7734,2024-01-09 08:03:05+00:00,[D] Are Custom LLM RAG apps going to become redundant?,"Loks like Copilot Studio is being rolled out (https://www.microsoft.com/en-us/microsoft-copilot/microsoft-copilot-studio) with an impressive looking no code/out of the box RAG solution.

There is a phenomenal amount of development and activity in the Open Source RAG world (e.g Langchain, Llamaindex, etc), which I am a great supporter of FYI.

However, what seems strange is that this no code out of the box solution (Copilot Studio - just as an example of one) seems overwhelmingly to be the better option if you wanted to build a RAG app i.e If you compare the cost to build and productionise a custom RAG app vs the cost of using Copilot Studio, it's almost an order of magnitude lower (no matter how you cut it with the developer time and duration). 

My question is, it seems to me we are moving towards a situation where enterprise solutions will make custom RAG apps redundant (not in all cases of course, but most cases), however there seems to be very little discussion of this relative to the activity in the open source community. Do people agree this is a likely scenario? 

Obviously there will be exceptions…but on most use cases I don’t see how you can compete with an instant/minimal setup, low cost, highly scalable RAG solution.",MachineLearning,https://www.reddit.com/r/MachineLearning/comments/1929n4f/d_are_custom_llm_rag_apps_going_to_become/,15,66,0.92,<praw.models.comment_forest.CommentForest object at 0x0000026E34720AD0>
