id,author,created,title,content,subreddit,url,num_comments,score,upvote_ratio,comments
196j1w0,AutoModerator,2024-01-14 16:00:18+00:00,[D] Simple Questions Thread,"Please post your questions here instead of creating a new thread. Encourage others who create new posts for questions to post here instead!

Thread will stay alive until next one so keep posting after the date in the title.

Thanks to everyone for answering questions in the previous thread!",MachineLearning,https://www.reddit.com/r/MachineLearning/comments/196j1w0/d_simple_questions_thread/,31,4,1.0,<praw.models.comment_forest.CommentForest object at 0x0000026E32BC4810>
19cqde6,automatonv1,2024-01-22 07:41:30+00:00,[D] After chatGPT are people still creating their own new custom NLP models these days?,"Been a little out of touch with training ML and DL models using scikit-learn and Tensorflow off-late. Just wondering if ML Engineers still train their own NLP models (or even CV, Prediction, Clustering models etc.) still.

If so, What kind of models are you training? And what use cases are you solving? If you replaced your custom models with ChatGPT, How is that going?

I would like to reacquaint myself with the ML ecosystem. Curious to hear your thoughts.",MachineLearning,https://www.reddit.com/r/MachineLearning/comments/19cqde6/d_after_chatgpt_are_people_still_creating_their/,44,51,0.85,<praw.models.comment_forest.CommentForest object at 0x0000026E32BDF850>
19cwf65,_learning_stuff_,2024-01-22 14:07:44+00:00,[D] Why we're not seeing a lot of content about Mamba architecture?,Like maybe some interviews with the authors? Yet to see e.g. TWIML AI podcast talk about Mamba architecture.,MachineLearning,https://www.reddit.com/r/MachineLearning/comments/19cwf65/d_why_were_not_seeing_a_lot_of_content_about/,3,3,1.0,<praw.models.comment_forest.CommentForest object at 0x0000026E32BB6490>
19ctbuq,SuperbMonk4403,2024-01-22 11:14:36+00:00,[D] ML dev in containers,"So like many others out there I’m in a predicament where I have a Linux development environment that I access through SSH (pretty awesome machines) but there are relatively bare metal and come with docker, Nvidia drivers, and some python. 
The catch: it’s all offline.

Instead of trying to guess and bring up eight versions etc, I’m working to pursue using containers (which only need to confirm compatibility with the nvidia driver).

I have two main questions:

1. Is there any benefit to either the NGC Container for PyTorch vs this PyTorch on on docker hub? I do like the devel base build due to having extra drivers and build tools.
2. For “remote” dev work I’m seeing two options: “dev containers” and Jupyter lab.

The dev containers I’m worried about confirming offline support, but a lot of people like the full IDE. Jupyter Lab I haven’t had much experience outside of the notebook. 
Does the Jupyter python IDE offer things like code completion and syntax highlighting?

Any insights are welcomed.


https://catalog.ngc.nvidia.com/orgs/nvidia/containers/pytorch

https://hub.docker.com/layers/pytorch/pytorch/2.0.1-cuda11.7-cudnn8-devel/images/sha256-4f66166dd757752a6a6a9284686b4078e92337cd9d12d2e14d2d46274dfa9048?context=explore",MachineLearning,https://www.reddit.com/r/MachineLearning/comments/19ctbuq/d_ml_dev_in_containers/,4,4,0.75,<praw.models.comment_forest.CommentForest object at 0x0000026E32BCA0D0>
19cvxz4,Street-Judgment7640,2024-01-22 13:44:41+00:00,[D] ARR 2023 December (NAACL 2024) Discussion,Reviews are supposed to be realeased today.,MachineLearning,https://www.reddit.com/r/MachineLearning/comments/19cvxz4/d_arr_2023_december_naacl_2024_discussion/,1,3,1.0,<praw.models.comment_forest.CommentForest object at 0x0000026E32BBE210>
19ctr9p,Conclusion_Silent,2024-01-22 11:42:27+00:00,[R] How Does the GPT-4V API deal with large Images?,"I want to pass varied-size infographics to the GPT4V model. I'm not sure what size to set and how to make my costs as low as possible. These Images can get quite large to the 5000 pixel range and can be of different pixel ratios too.  
\- What settings do I consider?  
\- I input the same images to ChatGPT Plus and it performs well but somehow I cant seem to figure out appropriate settings for the OpenAI API.

PS: If you can help me with this resolution thing for Multimodal models like Llava, Bakllava, Blip2, InstructBLIP, etc I'd be thankful",MachineLearning,https://www.reddit.com/r/MachineLearning/comments/19ctr9p/r_how_does_the_gpt4v_api_deal_with_large_images/,4,4,0.83,<praw.models.comment_forest.CommentForest object at 0x0000026E32B88D10>
19csc4x,Ok_Constant_9886,2024-01-22 10:05:18+00:00,[D] I wrote an article on everything I know about LLM evaluation metrics,"Hey everyone, I've been working non-stop in the LLM evaluation space for the past 6 months, from training custom LLMs for evaluation to building evaluation metrics on top of OpenAI's GPT models. I wrote a long article on everything I know about LLM evaluation metrics, and I hope someone finds this useful, may it be for interest or at work. Let me know if you found it useful or any questions/suggestions you may have!

Here is the link to the article: [https://medium.com/@jeffreyip54/llm-evaluation-metrics-everything-you-need-for-llm-evaluation-6b129157e33c](https://medium.com/@jeffreyip54/llm-evaluation-metrics-everything-you-need-for-llm-evaluation-6b129157e33c)

Thanks!",MachineLearning,https://www.reddit.com/r/MachineLearning/comments/19csc4x/d_i_wrote_an_article_on_everything_i_know_about/,0,5,0.86,<praw.models.comment_forest.CommentForest object at 0x0000026E32BCEE90>
19cxibs,ZhalexDev,2024-01-22 14:59:36+00:00,[P] I read through all NeurIPS 2023 Abstracts and wrote about it,"I made this resource that I think might be quite useful here, especially for those looking to find some new, relevant works to read or use for their own projects. It discusses the content from roughly 300 papers, but the topics broadly pertain to all of NeurIPS 2023. Happy reading!

Link: https://alexzhang13.github.io/blog/2024/neurips2023",MachineLearning,https://www.reddit.com/r/MachineLearning/comments/19cxibs/p_i_read_through_all_neurips_2023_abstracts_and/,0,2,1.0,<praw.models.comment_forest.CommentForest object at 0x0000026E32BB72D0>
19cx4ol,Bhargav_28,2024-01-22 14:41:49+00:00,[D] Early stopping but when ?,"Hello, 

I have been recently trying to find out better ways to use early stopping than patience and delta values, and I stumbled on this paper [https://page.mi.fu-berlin.de/prechelt/Biblio/stop\_tricks1997.pdf](https://page.mi.fu-berlin.de/prechelt/Biblio/stop_tricks1997.pdf) . Given the criteria mentioned in this paper I found it to be very logical to go ahead with this approach. I also happen to  notice that this is a very old paper and seems like none of the major platforms consider the implemenations here. Is there something I am completely missing on why this is not a valid approach ? ",MachineLearning,https://www.reddit.com/r/MachineLearning/comments/19cx4ol/d_early_stopping_but_when/,0,2,1.0,<praw.models.comment_forest.CommentForest object at 0x0000026E2F1641D0>
19cv8q6,cnichkawde,2024-01-22 13:07:31+00:00,[D] Beyond Transformers: Structured State Space Sequence Models, I wrote an article explaining the fundamentals of State Space Sequence Models. The purpose of this article is to present the foundational level concepts in a simplified manner. This field is rapidly evolving in the realm of artificial intelligence owing to the leap it gives over Transformer architecture in terms of speed and memory consumption. Here is the link to the article: [https://cnichkawde.github.io/statespacesequencemodels.html](https://cnichkawde.github.io/statespacesequencemodels.html) ,MachineLearning,https://www.reddit.com/r/MachineLearning/comments/19cv8q6/d_beyond_transformers_structured_state_space/,7,2,0.75,<praw.models.comment_forest.CommentForest object at 0x0000026E32BE58D0>
19cxv2b,javirk,2024-01-22 15:15:11+00:00,[D] Why use RLHF instead of simple loss backpropagation in LLMs?,"Hi, this might be a very simple question, but I can't wrap my head around it: why are LLMs trained with RLHF instead of treating the reward as a loss function and backpropagating as usual? The closest I have found about it is in the [DPO paper](https://arxiv.org/pdf/2305.18290.pdf) (end of Section 3): 

>Due to the discrete nature of language generation, this objective is not differentiable and is typically optimized with reinforcement learning

But I don't understand what part of the language generation is not differentiable when the reward model is a linear layer on top of the final transformer layer.

Thank you!",MachineLearning,https://www.reddit.com/r/MachineLearning/comments/19cxv2b/d_why_use_rlhf_instead_of_simple_loss/,0,1,1.0,<praw.models.comment_forest.CommentForest object at 0x0000026E32828550>
19cdcwz,APaperADay,2024-01-21 20:48:36+00:00,[R] VMamba: Visual State Space Model,"**Paper**: [https://arxiv.org/abs/2401.10166](https://arxiv.org/abs/2401.10166)

**Code and Models:** [https://github.com/MzeroMiko/VMamba](https://github.com/MzeroMiko/VMamba)

**Abstract:**

>Convolutional Neural Networks (CNNs) and Vision Transformers (ViTs)   stand as the two most popular foundation models for visual   representation learning. While CNNs exhibit remarkable scalability with   linear complexity w.r.t. image resolution, ViTs surpass them in fitting   capabilities despite contending with quadratic complexity. A closer   inspection reveals that ViTs achieve superior visual modeling   performance through the incorporation of global receptive fields and   dynamic weights. This observation motivates us to propose a novel   architecture that inherits these components while enhancing   computational efficiency. To this end, we draw inspiration from the   recently introduced state space model and propose the **Visual State Space  Model** (**VMamba**),  which achieves linear complexity without sacrificing  global receptive  fields. To address the encountered direction-sensitive  issue, we  introduce the Cross-Scan Module (CSM) to traverse the spatial  domain  and convert any non-causal visual image into order patch  sequences.  Extensive experimental results substantiate that VMamba not  only  demonstrates promising capabilities across various visual  perception  tasks, but also exhibits more pronounced advantages over  established  benchmarks as the image resolution increases. Source code  has been  available at [this https URL](https://github.com/MzeroMiko/VMamba).

**The other Vision Mamba:** [https://redd.it/19bgoug](https://redd.it/19bgoug)",MachineLearning,https://www.reddit.com/r/MachineLearning/comments/19cdcwz/r_vmamba_visual_state_space_model/,0,29,0.91,<praw.models.comment_forest.CommentForest object at 0x0000026E32BE75D0>
19cx8y6,RippSir,2024-01-22 14:47:21+00:00,[R] Where to place the most important instructions in prompts?,"Hi all,
do we know where is the optimal placement of most important instructions in (for example in gpt4 case) prompts? Is there some experimentally observed pattern of forgetting? Or is there some theoretical basis for such a pattern?

e.g. in RAG systems, the retrieved documents can form a large chunk of token limit, do we place instructions for answering before the documents or after them? How do we sort the documents in the prompt based on their relevancy?",MachineLearning,https://www.reddit.com/r/MachineLearning/comments/19cx8y6/r_where_to_place_the_most_important_instructions/,0,0,0.5,<praw.models.comment_forest.CommentForest object at 0x0000026E3282B810>
19csu68,risilm,2024-01-22 10:41:28+00:00,[P] Site for ML coding project?,"Hello, can someone suggest me where to find some projects to do using ML (preferably Python)? I feel like I am at a point in which I am kind of ok with the theory, but I experienced so far coding only in courses/filling notebooks, and I would like to build something on my own from scratch now. Suggestions?
Thanksss",MachineLearning,https://www.reddit.com/r/MachineLearning/comments/19csu68/p_site_for_ml_coding_project/,2,2,1.0,<praw.models.comment_forest.CommentForest object at 0x0000026E327C9890>
19cnsgm,AaronSpalding,2024-01-22 05:00:15+00:00,[R] How should I fuse prediction vectors from two quite different modalities?,"I am new to this field, and I need to implement a classifier which fuses the predictions from two other classifiers.

For example, I have classifier A for modality A (i.e. image frame) , and classifier B for modality B (audio).

Classifier A alone can achieve an accuracy of 90%, but classifier B can only achieve an accuracy of 66% for the same test data.

The output of classifier A is pred\_A, whose values look like -11.56, 8.73, -12.15, 10.07 ...

The output of classifier B is pred\_B, whose values look like  -0,068， 0.091, -0.125, 0.052 ...

What is the best way to fuse pred\_A and pred\_B to achieve a better accuracy?

I tried to directly add these two, but with no luck. Then, I am thinking if I should first concatenate these two vectors and then stack an additional torch.linear() on top of the concatenated vector and train everything, but still with no luck.

Could someone provide some comments here about what could easily go wrong?  Should I ""normalize"" or ""sigmoid"" these two vectors before passing them to torch.linear(), or something else?

Thanks in advance.",MachineLearning,https://www.reddit.com/r/MachineLearning/comments/19cnsgm/r_how_should_i_fuse_prediction_vectors_from_two/,4,5,0.73,<praw.models.comment_forest.CommentForest object at 0x0000026E32BF29D0>
19ce73y,gullydowny,2024-01-21 21:23:11+00:00,[D] What's the secret to getting set up with an Apple Silicon chip,"Trying to get a Docker container set up to train a Magenta model and I'm having massive problems with the M chip and Python.

Me and ChatGPT will figure it out eventually but is EVERYBODY working on this type of thing going through this? I've been at this for 12 hours, am I going to end up doing everything on an EC2 instance?

I'm not intending to train it on an M chip, just write the damned Python and deploy it",MachineLearning,https://www.reddit.com/r/MachineLearning/comments/19ce73y/d_whats_the_secret_to_getting_set_up_with_an/,10,19,0.72,<praw.models.comment_forest.CommentForest object at 0x0000026E32BF2C50>
19cou9l,paarulakan,2024-01-22 06:00:28+00:00,[D] How does augmentation by back translation works?,"Training LLMs on low resource languages requires augmentation. One of the popular method is to translate dataset from (mostly) English to desired language. 

Assuming that there is two models one already trained for translation(translation model), and a model(new-model) to be newly trained from data produced by translation-model. new-model is trained for language modelling objective. This approach works, but how? How is this helping the newly trained model? Why is it working? What information is gained from Translation model? Does this mean the Translation model is richer in information?

If the data (parallel corpus) used to train the translation-model is available for training new-model will the need for translated corpus vanish? (Since all the knowledge of the low resource language is gained from the original parallel corpus itself and we now directly have access to that)",MachineLearning,https://www.reddit.com/r/MachineLearning/comments/19cou9l/d_how_does_augmentation_by_back_translation_works/,2,3,0.8,<praw.models.comment_forest.CommentForest object at 0x0000026E3282AD50>
19cmwet,Standard_Letter_3196,2024-01-22 04:11:39+00:00,[D] LREC-COLING 2024 Discussion,"LREC-COLING reviews are coming out soon, so making a discussion post about it!",MachineLearning,https://www.reddit.com/r/MachineLearning/comments/19cmwet/d_lreccoling_2024_discussion/,10,4,1.0,<praw.models.comment_forest.CommentForest object at 0x0000026E32BF9D90>
19ct5ur,vooood,2024-01-22 11:03:21+00:00,[D] Question about training and/or creating a custom model," Hello,

I am I need of (very) specific reinforced training of an AI model or might be even a custom model, but am unsure where to turn.

What I need is an initial model where all vectors would be 0 at start and the model would be given input and all possible output options for the current input. This output would be sent to an API for evaluation and the API would return a score for reinforced learning depending on how appropiate the choice was.

The with sending the input and processing the output of the model with the API is straightforward, don't need help with that. What I need is help with what AI model should or could I do this? Is there a model where I don't need to define all tokens in advance but they could be added ""on the fly"" as new output options are given, depending on input? Would I have to create a completely new AI model for this rather than using existing ones?

Thank you in advance for your help. Please don't remove this post if this is a wrong subreddit, rather point me towards a proper one if I made a mistake.",MachineLearning,https://www.reddit.com/r/MachineLearning/comments/19ct5ur/d_question_about_training_andor_creating_a_custom/,0,1,1.0,<praw.models.comment_forest.CommentForest object at 0x0000026E32BF9990>
19ck4yy,vodku_buhayu,2024-01-22 01:49:08+00:00,[R] Survey About AI Trust and Trustworthiness,"Hello everyone, 

I am a Ph.D. student and a part of my thesis research is public perceptions of AI, specifically regarding trust and trustworthiness. So, I am looking for participants for my survey (it is a short Qualtrics survey that should take less than 10 minutes). I would really appreciate your input and insights! 

Link to the [survey](https://uoguelph.eu.qualtrics.com/jfe/form/SV_3skifTlwwwX70s6)

\*  The research is conducted by Cyber Science Lab at the University of Guelph, Guelph, Ontario, Canada. This project has received approval from the Research Ethics Board, ensuring compliance with Canadian federal guidelines for research involving human participants (REB#23-08-018).  ",MachineLearning,https://www.reddit.com/r/MachineLearning/comments/19ck4yy/r_survey_about_ai_trust_and_trustworthiness/,0,5,0.78,<praw.models.comment_forest.CommentForest object at 0x0000026E32BFA6D0>
19cshxy,vibrantform,2024-01-22 10:16:55+00:00,[Discussion] offline TTS with ssml tags,"Is there an off-line project similar to coqui-tts that uses ssml tags, at least ability to add some breaks / pauses? I know about piper. Unfortunately piper is not designed to work with coqui models and coqui doesn't support ssml tags. Other models available for piper are not that good and I am looking for an alternative. I am looking for a project that has good quality English pronunciation without added artificial emotions (preferably British but also US). I want to use it for articles, ebooks and language learning purposes.

&#x200B;

For example coqui model 21: tts\_models/en/vctk/vits seem pretty good. A lot of models don't pronounce some English words correctly (for example negotiate, negotiation).",MachineLearning,https://www.reddit.com/r/MachineLearning/comments/19cshxy/discussion_offline_tts_with_ssml_tags/,0,1,1.0,<praw.models.comment_forest.CommentForest object at 0x0000026E32C03A50>
19crtxp,yuvalgrader,2024-01-22 09:28:14+00:00,[D] Quick Poll: TensorFlow vs. PyTorch in 2024," As we progress in 2024, I'm curious to know the community's preference: TensorFlow or PyTorch? Which do you prefer for your projects and why 

[View Poll](https://www.reddit.com/poll/19crtxp)",MachineLearning,https://www.reddit.com/r/MachineLearning/comments/19crtxp/d_quick_poll_tensorflow_vs_pytorch_in_2024/,3,1,0.6,<praw.models.comment_forest.CommentForest object at 0x0000026E32BF8510>
19chbs4,Snoo_72181,2024-01-21 23:35:18+00:00,[D] What is state-of-the-art in object detection?,Also what are some good resources to stay updated on state-of-the-art models for various subsets of AI? And what other baseline models to compare them to?,MachineLearning,https://www.reddit.com/r/MachineLearning/comments/19chbs4/d_what_is_stateoftheart_in_object_detection/,1,6,0.88,<praw.models.comment_forest.CommentForest object at 0x0000026E32C0B290>
19bz6l5,Agitated-Ad809,2024-01-21 08:52:50+00:00,[D] Are there any hands on/practical ML YouTube channels?,I have been looking for practical DL or ML paper implementation or hands on YouTube channels. Are there any channels you'd recommend?,MachineLearning,https://www.reddit.com/r/MachineLearning/comments/19bz6l5/d_are_there_any_hands_onpractical_ml_youtube/,19,42,0.88,<praw.models.comment_forest.CommentForest object at 0x0000026E32C1CDD0>
19ccuw5,APaperADay,2024-01-21 20:27:35+00:00,[R] Leveraging Large Language Models for NLG Evaluation: A Survey,"**Paper**: [https://arxiv.org/abs/2401.07103](https://arxiv.org/abs/2401.07103)

**Abstract**:

>In the rapidly evolving domain of Natural Language Generation (NLG)  evaluation, introducing Large Language Models (LLMs) has opened new  avenues for assessing generated content quality, e.g., coherence,  creativity, and context relevance. This survey aims to provide a  thorough overview of leveraging LLMs for NLG evaluation, a burgeoning  area that lacks a systematic analysis. We propose a coherent taxonomy  for organizing existing LLM-based evaluation metrics, offering a  structured framework to understand and compare these methods. Our  detailed exploration includes critically assessing various LLM-based  methodologies, as well as comparing their strengths and limitations in  evaluating NLG outputs. By discussing unresolved challenges, including  bias, robustness, domain-specificity, and unified evaluation, this  survey seeks to offer insights to researchers and advocate for fairer  and more advanced NLG evaluation techniques.",MachineLearning,https://www.reddit.com/r/MachineLearning/comments/19ccuw5/r_leveraging_large_language_models_for_nlg/,0,3,0.72,<praw.models.comment_forest.CommentForest object at 0x0000026E32C1B910>
19bzlxd,ShoeStatus2431,2024-01-21 09:22:12+00:00,[Discussion] Re-using state from LLM's / next-token predictors as an optimization,"I've been pondering how GPT-3/4 must work internally and possible optimizations. I'm wondering if someone could point me to research already done in this area -- or if I completely misunderstand how these models work.

So basically I'm wondering about the 'next-token' predictor aspect. Despite their function of predicting the next token, it seems evident to me that these models must have an internal process (developed in a 'black box' fashion during training) that anticipates the rest of the response. This anticipation appears necessary to prevent the model from emitting a next token that causes a dead-end, making it impossible to construct a coherent sentence.

Moreover, this foresight seems to extend beyond single sentences. GPT-4 responses often exhibit a highly structured format, including an introduction, in-depth analysis, and conclusion, indicating a higher level of planning or disposition in the answer. This leads me to believe that even though the model generates only one next token at a time, it might internally form a more complete response to ensure a well-chosen next token. Likely not in a way that the full response is hashed out in the normal token representation, but at least some internal representation close to this. Especially for shorter ranges (sentences) I imagine it could be quite precise, but over longer ranges (paragraphs etc.) perhaps it is more and more abstract.

This understanding raises a question: Is there a way to extract more of the full response from the network directly? Currently, it seems that the entire calculation is repeated with each token, taking into account the previously emitted token. I suspect that a significant portion of these calculations could be similar, or at least there might be a more efficient pathway to generate the complete answer from the internal state after the first token is emitted.

In practice, this might involve altering the model to produce longer or complete responses in each iteration, rather than just a single token. Alternatively, a secondary, smaller model could be developed to 'peek' into the internal state of the primary model after one token generation and generate complete answers from that. Or perhaps, a model trained in a way that allows for reusing internal states, thereby accelerating the generation of subsequent tokens. Perhaps something like simply restarting from the same state or shifting it somehow.

I'm curious about the feasibility of these ideas and whether they align with the current understanding of LLMs. I look forward to hearing your thoughts, especially if there are fundamental misunderstandings in my assumptions about how LLMs work.",MachineLearning,https://www.reddit.com/r/MachineLearning/comments/19bzlxd/discussion_reusing_state_from_llms_nexttoken/,56,28,0.88,<praw.models.comment_forest.CommentForest object at 0x0000026E32C47DD0>
